{
  "id": "devstral-24b",
  "label": "Devstral 24B",
  "ollamaTag": "devstral:24b",
  "sizeGb": 14.0,
  "minVramGb": 24,
  "gpuTypeIds": [
    "NVIDIA GeForce RTX 4090",
    "NVIDIA RTX A5000",
    "NVIDIA GeForce RTX 3090",
    "NVIDIA RTX PRO 4000 Blackwell",
    "NVIDIA RTX PRO 4500 Blackwell",
    "NVIDIA A40"
  ],
  "estCostPerHr": 0.44,
  "tags": ["agentic", "coding", "quality"]
}
