{
  "id": "qwen-coder-7b",
  "label": "Qwen2.5-Coder 7B",
  "ollamaTag": "qwen2.5-coder:7b",
  "sizeGb": 4.7,
  "minVramGb": 12,
  "gpuTypeIds": [
    "NVIDIA GeForce RTX 3080 Ti",
    "NVIDIA GeForce RTX 4070 Ti",
    "NVIDIA RTX A4000",
    "NVIDIA GeForce RTX 4080"
  ],
  "estCostPerHr": 0.22,
  "tags": ["coding", "recommended"]
}

